{
  "jurisdiction": "EU",
  "version": "EU-2026.1",
  "effective_from": "2025-06-28",
  "status": "draft",
  "legal_basis": "EAA 2019/882 → EN 301 549 V3.2.1 → WCAG 2.1 AA",
  "rule_refs": [
    {
      "rule_code": "wcag-2.2-1.1.1",
      "weight": 9,
      "mandatory": true
    },
    {
      "rule_code": "wcag-2.2-1.2.1",
      "weight": 7,
      "mandatory": true
    },
    {
      "rule_code": "wcag-2.2-1.2.2",
      "weight": 7,
      "mandatory": true
    },
    {
      "rule_code": "wcag-2.2-1.2.3",
      "weight": 7,
      "mandatory": true
    },
    {
      "rule_code": "wcag-2.2-1.3.1",
      "weight": 8,
      "mandatory": true
    },
    {
      "rule_code": "wcag-2.2-1.3.2",
      "weight": 7,
      "mandatory": true
    },
    {
      "rule_code": "wcag-2.2-1.3.3",
      "weight": 7,
      "mandatory": true
    },
    {
      "rule_code": "wcag-2.2-1.4.1",
      "weight": 7,
      "mandatory": true
    },
    {
      "rule_code": "wcag-2.2-1.4.2",
      "weight": 7,
      "mandatory": true
    },
    {
      "rule_code": "wcag-2.2-2.1.1",
      "weight": 10,
      "mandatory": true
    },
    {
      "rule_code": "wcag-2.2-2.1.2",
      "weight": 10,
      "mandatory": true
    },
    {
      "rule_code": "wcag-2.2-2.1.4",
      "weight": 7,
      "mandatory": true
    },
    {
      "rule_code": "wcag-2.2-2.2.1",
      "weight": 7,
      "mandatory": true
    },
    {
      "rule_code": "wcag-2.2-2.2.2",
      "weight": 7,
      "mandatory": true
    },
    {
      "rule_code": "wcag-2.2-2.3.1",
      "weight": 7,
      "mandatory": true
    },
    {
      "rule_code": "wcag-2.2-2.4.1",
      "weight": 7,
      "mandatory": true
    },
    {
      "rule_code": "wcag-2.2-2.4.2",
      "weight": 7,
      "mandatory": true
    },
    {
      "rule_code": "wcag-2.2-2.4.3",
      "weight": 7,
      "mandatory": true
    },
    {
      "rule_code": "wcag-2.2-2.4.4",
      "weight": 8,
      "mandatory": true
    },
    {
      "rule_code": "wcag-2.2-2.5.1",
      "weight": 7,
      "mandatory": true
    },
    {
      "rule_code": "wcag-2.2-2.5.2",
      "weight": 7,
      "mandatory": true
    },
    {
      "rule_code": "wcag-2.2-2.5.3",
      "weight": 7,
      "mandatory": true
    },
    {
      "rule_code": "wcag-2.2-2.5.4",
      "weight": 7,
      "mandatory": true
    },
    {
      "rule_code": "wcag-2.2-3.1.1",
      "weight": 7,
      "mandatory": true
    },
    {
      "rule_code": "wcag-2.2-3.2.1",
      "weight": 7,
      "mandatory": true
    },
    {
      "rule_code": "wcag-2.2-3.2.2",
      "weight": 7,
      "mandatory": true
    },
    {
      "rule_code": "wcag-2.2-3.3.1",
      "weight": 8,
      "mandatory": true
    },
    {
      "rule_code": "wcag-2.2-3.3.2",
      "weight": 8,
      "mandatory": true
    },
    {
      "rule_code": "wcag-2.2-4.1.2",
      "weight": 9,
      "mandatory": true
    },
    {
      "rule_code": "wcag-2.2-1.2.4",
      "weight": 6,
      "mandatory": true
    },
    {
      "rule_code": "wcag-2.2-1.2.5",
      "weight": 6,
      "mandatory": true
    },
    {
      "rule_code": "wcag-2.2-1.3.4",
      "weight": 6,
      "mandatory": true
    },
    {
      "rule_code": "wcag-2.2-1.3.5",
      "weight": 6,
      "mandatory": true
    },
    {
      "rule_code": "wcag-2.2-1.4.3",
      "weight": 9,
      "mandatory": true
    },
    {
      "rule_code": "wcag-2.2-1.4.4",
      "weight": 7,
      "mandatory": true
    },
    {
      "rule_code": "wcag-2.2-1.4.5",
      "weight": 6,
      "mandatory": true
    },
    {
      "rule_code": "wcag-2.2-1.4.10",
      "weight": 7,
      "mandatory": true
    },
    {
      "rule_code": "wcag-2.2-1.4.11",
      "weight": 6,
      "mandatory": true
    },
    {
      "rule_code": "wcag-2.2-1.4.12",
      "weight": 6,
      "mandatory": true
    },
    {
      "rule_code": "wcag-2.2-1.4.13",
      "weight": 6,
      "mandatory": true
    },
    {
      "rule_code": "wcag-2.2-2.4.5",
      "weight": 6,
      "mandatory": true
    },
    {
      "rule_code": "wcag-2.2-2.4.6",
      "weight": 6,
      "mandatory": true
    },
    {
      "rule_code": "wcag-2.2-2.4.7",
      "weight": 8,
      "mandatory": true
    },
    {
      "rule_code": "wcag-2.2-3.1.2",
      "weight": 6,
      "mandatory": true
    },
    {
      "rule_code": "wcag-2.2-3.2.3",
      "weight": 6,
      "mandatory": true
    },
    {
      "rule_code": "wcag-2.2-3.2.4",
      "weight": 6,
      "mandatory": true
    },
    {
      "rule_code": "wcag-2.2-3.3.3",
      "weight": 6,
      "mandatory": true
    },
    {
      "rule_code": "wcag-2.2-3.3.4",
      "weight": 6,
      "mandatory": true
    },
    {
      "rule_code": "wcag-2.2-4.1.3",
      "weight": 6,
      "mandatory": true
    }
  ],
  "report_template_id": "tmpl-eu-conformance",
  "seed": true,
  "seed_provenance": "بذر أولي من EN 301 549 V3.2.1 الفصل 9. ترجيحات موحّدة مع DE (نفس الأساس التقني) — تُوقَّع قبل النشر.",
  "signed_by": null,
  "signed_at": null,
  "source_change_events": []
}
